Fandom,Link,Title,Description
Harry Potter,https://www.fanfiction.net/s/10787301/1/,Lily's Next Great Adventure,"When Lily Potter dies, she meets Death in the afterlife. She has a choice: move on with James, or help Harry with his destiny. She takes the second choice. But something goes wrong. Now a girl named Holly Evans will help Harry on his path to his destiny."
Harry Potter,https://www.fanfiction.net/s/5901283/1/,Lily's Plan,What if Lily has survived the attack at Godric's Hallow and raised Harry on her own?
Harry Potter,https://www.fanfiction.net/s/6554334/1/,Lion : Lion's Pride,"After Ron's death, Harry and company face their sixth year at Hogwarts. Trained by Dumbledore, will they unlock the secret in how to defeat Voldemort?"
Harry Potter,https://www.fanfiction.net/s/6311215/1/,Lion : The Lion Tamer,"Daphne likes Harry, and decides she wants to get to know him. Harry is receptive to her advances. Little do they know of how their blossoming relationship will change the course of fate."
Harry Potter,https://www.fanfiction.net/s/6944370/1/,Lion : The Lion's Roar,"Dumbledore has died and left Harry one final task. With Daphne, Hermione and Neville at his side, Harry intends to end the war started the night his parents were killed."
Harry Potter,http://ficwad.com/story/226592,Loker Room,During his fifth year Harry is tired of the chasers berating him. When one of them hears his rant they feel bad and decide to make it up to him.
Harry Potter,http://hp.adult-fanfiction.org/story.php?no=600094222,Losing Control,"Ginny is finishing an assignment in the library when Harry enters, acting very strangely."
Harry Potter,http://ficwad.com/story/58132,Love Has No Age,"Harry is told that he has the power of Love? With the help of a Gabrielle, Ginny and a few others he learns exactly what this means!"
Harry Potter,http://hp.adult-fanfiction.org/story.php?no=600095937,Love in a Major Key,Harry and Ginny comfort a distraught Hermione after she breaks up with Ron and she goes to their home for help. The trio of friends discover that they can make beautiful music together.
Harry Potter,https://www.fanfiction.net/s/5872003/1/Love_me_tonight,Love me tonight,"Un prédateur rode dans la Forêt Interdite, une créature dangereuse, un être qu'il ne vaut mieux pas rencontrer. Pourtant, il y aura une personne pour croiser son chemin . . . Et débuter une toute nouvelle vie."
Harry Potter,https://www.fanfiction.net/s/7427672/1/,Love me tonight : Bloody war,"Tout recommença lorsque je reçus une lettre de Remus Lupin. Un homme dont je n'avais pas eu de nouvelles depuis treize ans, lors de mon départ d'Angleterre."
Harry Potter,https://www.fanfiction.net/s/7606181/1/,Love Will Conquer All,"Harry, Ron and Hermione have to find a weapon that can channel love so they can defeat Voldermort. Ginny returns to Hogwarts but refuses to give in to the death eaters, Voldermort is more interested in her then she thinks..."
Harry Potter,https://www.fanfiction.net/s/7146790/1/,Magnolia Crescent,"Instead of watching, Black talks to Harry before the Knight Bus arrives. This simple and seemingly small decision opens new doors for Harry, giving him more spells, new abilities, and a new outlook on people in general."
Harry Potter,http://archiveofourown.org/works/3236270,Malfoy Manipulations,"Harry has plans to resume his relationship with Ginny. Unfortunately, Mrs. Malfoy calls in Harry's debt to her."
Harry Potter,https://www.fanfiction.net/s/7392297/1/,Master Manipulators,Post GOF Harry has to go to the Dursleys again but does he? A strange man claiming to be Harry's uncle is shaking to world Dumbledore worked hard to build.
Harry Potter,https://www.fanfiction.net/s/7751930/1/,Master Manipulators : The Manipulation of War,"The time for subtle manipulation is over, it is time for war."
Harry Potter,https://www.fanfiction.net/s/5371734/1/,Mending Bridges Broken,Cho Chang is determined to mend what went awry between she and Harry Potter.
Harry Potter,https://www.fanfiction.net/s/7694530/1/,"Midnight Gold, The Rise Of The Forgotten Lord","The chronicles of the rise of Lord Harry James Potter and his battle to rebuild the Potter family to its former glory, while working to prove himself worthy of the Potter name and its ancient legacy. "
Harry Potter,https://www.fanfiction.net/s/7984462/1/,More than just Teammates,"Set before 4th year and after Quidditch World Cup, Harry has a surprise encounter with one of his teammates. He later makes a surprise discovery at Gringotts."
Harry Potter,http://hp.adult-fanfiction.org/story.php?no=600007121,Muggle Things,Hermione teaches Harry and Ron about Muggle things
Harry Potter,https://www.fanfiction.net/s/5817703/1/,my dirty little secret,la première fois d'un couple peu banal.
Harry Potter,https://www.fanfiction.net/s/9454389/1/,My Green Eyed Mystery,"Now that Voldemort has been defeated again, the Ministry still under the rule of Fudge, has issued a Repopulation Act. So it happened that Ginny Weasley ends up engaged to the coldest snake in Slytherin named Harry Potter. However as most things these days, nothing is quite how it seems."
Harry Potter,https://www.fanfiction.net/s/6289435/1/,Myrddin Emrys Returns,"Souls don't always live just once. They can return, typically in a time of crisis, if they are deemed worthy. This is about two such souls. Separated by houses. Will they find each other again? Will they even know? One Gryffindor, one Slytherin."
Harry Potter,https://www.fanfiction.net/s/3877632/1/,Mystère sous la lune,"Sarah n'a pas d'amis, elle est dans la maison Serpentard, mais n'en a pas le caractère, elle s'habille toujours en noir, elle a même teint ses cheveux en noir et parle rarement. Cela va intriguer en cette septième année Lily Evans..."
Harry Potter,https://www.fanfiction.net/s/1721371/1/,"Naraë Harry Potter, Nöé Naraë Tom Elvis Jedusor","Harry Potter, sans autre espoir de vaincre le mage noir, repart 20 ans dans le passé pour tenter de sauver ceux qu'il a aimé et éradiquer à la base Voldemort."
Harry Potter,https://www.fanfiction.net/s/2127558/1/,Narcotic Effects,"After the final battle Harry can find solace in nothing and believes himself to be a failure because of the loss of his friends. A certain manipulative, platinum haired woman decides to yank him out of the downward spiral that is his life"
Harry Potter,http://ficwad.com/story/86551,Nephilim's Power,"Harry realizes that he is a Nephilim, a type of dark angel that gets its power from sex. His Nephilim powers have not matured and grown over the years because he has not had sex, so what does sixte..."
Harry Potter,https://www.fanfiction.net/s/6763629/1/,New Love,"They always say love can be dangerous, but it's always worth it right? 17 year old Harry, Goblet of Fire saga moved up to Harry's 7th year with different scenarios before that. Story set in modern times with modern technology."
Harry Potter,http://hp.adult-fanfiction.org/story.php?no=600096808,Night Patrol,Follow Harry Potter as he goes on night patrol as a prefect.
Harry Potter,https://www.fanfiction.net/s/6755363/1/,No Hurry At All,"Remus was so shocked at seeing Sirius fall through the veil that Harry had raced past him before the boy's intentions even registered with the werewolf. Screaming ""Sirius!"" Harry followed his godfather into the veil before anyone could stop him."
Harry Potter,https://www.fanfiction.net/s/8860416/1/,No Name,Le paraitre et les quand dira-t-on sont deux éléments essentiels à la grandeur et à la notoriété d'une famille de sang pur. Mais attention aux squelettes qui dorment dans le placard et qui sont sur le point de se montrer au grand jour…
Harry Potter,https://www.fanfiction.net/s/9807253/1/,Not a Crapalogue,"In honor of November, a new Epilogue each day that does not suck like the one in the book."
Harry Potter,https://www.fanfiction.net/s/7825321/1/,Not Fate ,"A 30 year old Hermione decides that she needs a change. A 32 year old Fleur is led to the same conclusion. How will their new lives intersect, and what demons might be in the past? "
Harry Potter,https://www.fanfiction.net/s/5399481/1/,Not Go Gentle,https://www.fanfiction.net/s/5399481/1/
Harry Potter,https://www.fanfiction.net/s/9421929/1/,Not just a Bookworm,"What if Hermione answered more aggresively when Harry screamed at his two friends as he arrived. It turns to a shouting contest between two friends. Because of his anger, Harry hurts Hermione's feelings. Harry has to learn to take his anger out of people who really deserved and this leads to a really different 5th year."
Harry Potter,https://www.fanfiction.net/s/7144149/1/,Not Normal,"His life was never normal, then it becomes truly abnormal. He must save a world he never cared for, but with others ... he can care."
Harry Potter,https://www.fanfiction.net/s/9606531/1/,Not Normal : The New Normal,Harry's life has changed from what it once was and he must accept his new life so that he might prepare for the war that looms in the future to avoid a far worse war he knows would be the price of failure.
Harry Potter,http://archiveofourown.org/works/724280,Not The Last Time,"Fleur and Hermione have a history. But due to the hunt for the Horcruxes, Hermione knew that she had to sever all ties. Friends, family, lover... Only Harry, Ron and she could do this."
Harry Potter,https://www.fanfiction.net/s/3882344/1/,Not the Only Redhead,"Harry asks Ginny to the Yule Ball. Everyone believes Harry is destined to be with a redhead. There is more than one redhead in Hogwarts, though."
Harry Potter,https://www.fanfiction.net/s/7346702/1/,Nothing In Return,"When an imperiused Ron destroys all bonds between the Potters and the Weasleys, Ginny is left with a terrible choice: disown herself and keep loving and supporting Harry from afar, or be forced to hate him against her will."
Harry Potter,http://ficwad.com/story/86267,Nymph in Servitude,Hawk's response to the CJ Cold Tonks Slave Challenge on the PP3 group. Released in celebration of TFF's 1000th member!
Harry Potter,https://www.fanfiction.net/s/10256543/1/,Nymphadora's Beau,"In the summer prior to fifth year, Andromeda Tonks finds out her daughter Nymphadora has set her sights on Remus Lupin. She's not happy with this, and tricks Tonks into going for Harry Potter instead. What starts out as a way to ""get back"" at her parents, turns into an uncommon romance..."
Harry Potter,http://hp.adult-fanfiction.org/story.php?no=600021907,Of a trunk and the nice bum sitting on top of it,Ginny fancies Hermione and decides that the only possible course of action to get Hermione to consider being with a girl is by being overtly direct
Harry Potter,https://www.fanfiction.net/s/9336526/1/,Of Death and Fate,"After an altered incident at the World Cup, Harry Potter is thrust into a new situation with old and new friends to help him achieve more than he would have ever dreamed for himself."
Harry Potter,https://www.fanfiction.net/s/9035181/1/,Of Gods And Men,arry's ancestors made enemies many centuries before he was born. A kindly god is able to find out about the plot and derail it before an innocent life was snuffed out. With the help of the gods Harry is able to survive his childhood before Hogwarts comes along. 
Harry Potter,https://www.fanfiction.net/s/4536005/1/,Oh God Not Again!,"So maybe everything didn't work out perfectly for Harry. Still, most of his friends survived, he'd gotten married, and was about to become a father. If only he'd have stayed away from the Veil, he wouldn't have had to go back and do everything AGAIN."
Harry Potter,https://www.fanfiction.net/s/8295633/1/,"Old Friends, New Friends","""That date was the reason I was shocked to death when I saw that troll. Of course my hero Harry then came to save me and defeat the big bad troll."" Tonks ended dramatically, placing a sloppy kiss on Harry's red cheek. He would die before he admitted this to her, but when she said that, he felt rather proud of himself."
Harry Potter,https://www.fanfiction.net/s/7169075/1/,On Teenagers And Love,"On the surface, things are not always what they seem. Everything has taken on a far more serious tone as Hermione and Fleur attempt to navigate their constantly shifting relationship during Hermione's sixth year at Hogwarts. War is coming, and they can feel it in their bones."
Harry Potter,http://archiveofourown.org/works/2603054,On The Dangers Of Combining Whisky & Slytherins,Harry isn't sure the way Spin the Bottle is supposed to be played but this is probably not it...
Harry Potter,https://www.fanfiction.net/s/9406757/1/,One Misfired Spell Later,"Harry is hit by a misfired undoing spell in third year, and starts to remember things causing him to flee together with Hermione and a few others, including a godfather he didn't know he have. For Wizarding Britain and Dumbledore in particular old oaths and secrets are now brought to light."
Harry Potter,https://www.fanfiction.net/s/6148504/1/,One Step at a Time,"Fleur's life is a sham. She comes to Hermione for help with something important and Hermione accepts to lend a hand. Throughout their journey, many things will change and they will find out what true love really is."
Harry Potter,https://www.fanfiction.net/s/7058158/1/,One Traffic Light,"What could've happened if the Dursleys avoided one traffic light, and Harry arrived at Kings Cross Station just a few minutes early? A chance for Ginny to do something she'd wanted to do all her life."
Harry Potter,https://www.fanfiction.net/s/10142840/1/,One Traffic Light : A Missed Traffic Light,What if Harry got to the Platform early in book 1?
Harry Potter,https://www.fanfiction.net/s/10159822/1/,One Traffic Light : The Bonds of Friendship,"It is now second year. What surprises are in store for Harry, Ginny and Hermione this year?"
Harry Potter,https://www.fanfiction.net/s/10185093/1/,One Traffic Light : Werewolves And Animaguses,What will the trio get up to this year? And what do the Weasleys have planned?
Harry Potter,http://hp.adult-fanfiction.org/story.php?no=600096706,Our Secret,Hermione is woken in the middle of the night by a noise and decides to investigate.
Harry Potter,https://www.fanfiction.net/s/6783306/1/Paging-Dr-Bell,Paging Dr Bell,"The 15 year anniversary of Voldemort's defeat is near so Luna is writing the behind the scenes look at what the 'power He knew not' was all about. She turns to Dr. Bell, famous psychologist, for her unique view of the B-W-L. Year 1 onwards w/future perspective. Harry/Multi due to House needs."
Harry Potter,https://www.fanfiction.net/s/1729606/1/,Pain and Press,"Un petit FleurHermione, à la limite du pwp, du fluff..."
Harry Potter,https://www.fanfiction.net/s/5883955/1/,Parfaites Situations,"Harry a tué Voldemort au prix de sa vie. A son enterrement tous ses proches sont là, mais c'est une personne de la maison de Serpentard qui dépeindra dans son eulogie la vraie vie et personnalité ainsi que les épreuves subies par le Héros de Gryffondor."
Harry Potter,https://www.fanfiction.net/s/5374899/1/,Perfect Past,A choice between love and life itself. She will lose either way. Hermione is everything Narcissa came to love but was taught to hate. Is love really stronger than hatred?
Harry Potter,https://www.fanfiction.net/s/5599533/1/,Phoenix Eclipse,"When he was 10, Harry Potter was declared a Death Eater by his family. 5 years later, he has returned but is he willing to join in the war to help the brother who turned on him?"
Harry Potter,http://archiveofourown.org/works/2159955,Playing Games,She doesn’t want to make it an easy victory
Harry Potter,https://www.fanfiction.net/s/7550989/1/,PoA: A New Direction,Starts during PoA after Harry blew his aunt up. Harry makes a discovery at Diagon Alley that changes his life forever.
Harry Potter,http://ficwad.com/story/226584,Poker Night,It's the Gryffindor/Hufflepuff sixth year poker night and Harry decides do spice things up with a little bet when things begin to look good.
Harry Potter,https://www.fanfiction.net/s/4455612/1/,Potter's Bones,Harry is depressed after the disaster in the Department of Mysteries and decides to remove himself from his friends to protect them. What happens when a pretty Hufflepuff finds him? What about his female best friend?
Harry Potter,https://www.fanfiction.net/s/10648755/1/,Potter's Hands: Slytherin," Daphne Greengrass doesn't allow herself to relax as often as she should and her health is suffering because of it. Rumour and gossip state that Harry Potter, as an aspiring medical prodigy can help. Massages are supposed to be therapeutic after all..."
Harry Potter,http://www.hpfanfiction.org/fr/viewstory.php?sid=18010,"Pour un simple ""oui""",Petite O.S. sur les Maraudeurs.
Harry Potter,https://www.fanfiction.net/s/4797749/1/,"Pourquoi Elle, James ?","Lily contemple d'un oeil rêveur une de ses amies en couple avec l'homme de ses rêves... Mais lorsqu'ils rompent beaucoup de choses ont changé, dont Lily."
Harry Potter,https://www.fanfiction.net/s/6919613/1/,Première fois,"Hermione et Ginny sont ensemble, et vont pour la première fois s'unir toutes les deux ensembles..."
Harry Potter,https://www.fanfiction.net/s/8233291/1/,Princess of the Blacks,Sirius searches for his goddaughter and finds her in one of the least expected and worst possible locations and lifestyles.
Harry Potter,https://www.fanfiction.net/s/9937462/1/,Princess of the Blacks : Black Princess Ascendant," Last year, Jen had to contend with a deadly Tournament, a revived Dark Lord, a meddlesome Headmaster, and worst of all, reconciliation attempts by her parents. Surely her OWL year can't be anywhere near as complicated. Can it?"
Harry Potter,https://www.fanfiction.net/s/7550923/1/,Professeur!,"Enseigner la DCFM à Poudlard, c'est bien. Etre mariée à Remus Lupin, c'est mieux. Avoir les deux à la fois, c'est pas mal du tout. Mais sortir ses squelettes du placard, ça, c'est totalement nul..."
Harry Potter,http://ficwad.com/story/86637,Quidditch Practice',Harry gets laid by three hot chasers when Angelina schedules a ‘extra Quidditch practice’ with only the seeker and chasers. These wicked girls certainly do plan to ride a broomstick.
Harry Potter,https://www.fanfiction.net/s/6652537/1/,"Quoth the Raven, Nevermore","The Tower of London has a dark and bloody past both in the muggle and wizarding worlds. Besides being a prison, it also served as a sanctuary in times past, what if it became one yet again?"
Harry Potter,https://www.fanfiction.net/s/6272062/1/,Rabid Plot Fox,Harry Potter and Daphne Greengrass adventures. Because my ideas have to go somewhere.
Harry Potter,http://ficwad.com/story/31936,Re-Ordered,When would be one of the worst points in time for an over-powered Harry to return to his past? During the Trial before the Wizengamot!
Harry Potter,https://www.fanfiction.net/s/3236801/1/,Redistribution à la répartition,"Imaginez qu'Harry, Hermione, Ron et les autres Gryffondors ait été envoyé à Serpentard ! Imaginez que Malefoy, Pansy et les autres vipères soient des lions…"
Harry Potter,https://www.fanfiction.net/s/7531037/1/,Regardemoi !,Quand la vérité en cache une autre.
Harry Potter,https://www.fanfiction.net/s/4936039/1/,Remember,"The summer after the Chamber of Secrets was hard. Why can't Harry remember what happened? Realizing he's missing memories, Harry and Remus set out to find out what happened. What about that red-head he's been dreaming about?"
Harry Potter,http://www.hpfanfiction.org/fr/viewstory.php?sid=20939,Retour à Poudlard,Neville Londubat revient à Poudlard onze ans après la bataille afin d'y enseigner la Botanique. Revivez dans ce OS son retour à l'école entre nouvelles rencontres et souvenirs...
Harry Potter,http://www.hpfanfiction.org/fr/viewstory.php?sid=20985,"Retour à Poudlard : ""On se retrouve en salle des profs ?""",Les directeurs de maisons sont-ils aussi sérieux qu'ils veulent nous faire croire ? Qui est la personne qui a osé profaner le mémorial de la bataille de Poudlard ? Neville Londubat revient à Poudlard onze ans après la bataille afin d'y enseigner la Botanique.  Découvrez dans cette fiction son retour à Poudlard entre souvenirs et nouvelles rencontres...
Harry Potter,https://www.fanfiction.net/s/4655545/1/,Reunion,It all starts with Hogwarts' Class Reunion.
Harry Potter,http://hp.adult-fanfiction.org/story.php?no=600012547,Revenge,Ginny extorts revenge in a way Harry didn't quite expect.
Harry Potter,http://ficwad.com/story/101738,Revenge is a Dish Best Served with Chocolate,Ginny get even with Harry and Luna in a most 'delicious' fashion.
Harry Potter,http://archiveofourown.org/works/1947039,Revenge Is A Dish Best Served With Firewhisky,"Harry and Daphne hit it off at Draco Malfoy's wedding reception over a mutual loathing of the groom, and don't try very hard to hide it."
Harry Potter,http://archiveofourown.org/works/2802227,Ringing in the New Year Greengrass Style,Daphne and her sister Astoria are bored at their family's annual New Year party. Can Harry spice it up for them? Sophia Greengrass is an OC of mine.
Harry Potter,http://hp.adult-fanfiction.org/story.php?no=600007117,Risk,There were just some things that were definitely worth the risk
Harry Potter,https://www.fanfiction.net/s/5721324/1/,Rocking the Boat,"Harry is left with the Dursleys just after his godfather had died. One thing leads to the other and Harry is fed up with being a puppet. He breaks free and finds help. And boy, does he start rocking the boat."
Harry Potter,https://www.fanfiction.net/s/6899745/1/,Rolling in the deep,Loving someone will often bring out the best in a person.In Hermione's situation loving someone only unleashes anger she did not know she possessed.Can they mend what was broken.
Harry Potter,https://www.fanfiction.net/s/7479170/1/,Rolling in the deep : A Mother's Wrath,Set while Lyra was six.
Harry Potter,https://www.fanfiction.net/s/7739029/1/,Room of Requirement I,"Room of requirement has a weekly ""gathering"". Hermione hears about it and decides to go."
Harry Potter,https://www.fanfiction.net/s/2132034/1/,RSerie : The Chamber of Secrets: Reopened,"Harry and company return to Hogwarts, only to be faced with more trouble. The group finds a new hideout and Harry ends up once more saving the school from the Dark Lord."
Harry Potter,https://www.fanfiction.net/s/2845160/1/,RSerie : The Goblet of Fire: Rekindled,"Harry gets into more trouble than he realizes when his name pops out of the Goblet of Fire. A year of headaches and hardships confront him, but something much darker lies on the horizon."
Harry Potter,https://www.fanfiction.net/s/3359932/1/,RSerie : The Order of the Phoenix: Reassembled,"A Ministry loyal woman comes to teach at Hogwarts. Harry's relationship with Tonks is stressed. Pushed to and over his breaking point, will Harry be able to survive the year with his sanity intact?"
Harry Potter,https://www.fanfiction.net/s/2008185/1/,RSerie : The Philosopher's Stone Retransmuted,"Harry, abused by the Dursleys, meets a young Metamorphmagus one morning in the park. The girl reveals who Harry really is and where he'll soon be going."
Harry Potter,https://www.fanfiction.net/s/2576886/1/,RSerie : The Prisoner of Azkaban Returns,"Harry faces a murderous prisoner, learns a secret about one of his friends, and travels through time before the year comes to an end."
Harry Potter,https://www.fanfiction.net/s/5087671/1/,Runic Animagi,Harry decides to have a little fun after hearing the Prophecy as a death sentence and his life takes on a life of its own!
Harry Potter,https://www.fanfiction.net/s/1711866/1/,Ruptures d'un processus linéaire,"Il aurait dû le savoir... Retomber sur Dudley ce soir là dans un bar, ça pouvait pas en rester là... Tomber amoureux, régler ses comptes avec Fudge, inspirer des jeux vidéos... Quand le Survivant chasse ses fantômes"
Harry Potter,https://www.fanfiction.net/s/7806627/1/,Sacrificial Second Chance,"Harry dies killing Voldemort,and is given the chance to go to a world where his parents are still alive.See how he handles all that life throws at him."
Harry Potter,https://www.fanfiction.net/s/7192167/1/,Safe Keeping,Hermione Granger has been harboring an obsession over the Lady of the Manor for quite some time. A new threat to the Malfoys has brought Hermione to the Manor and things will never be the same for anyone involved.
Harry Potter,http://www.hpfanfiction.org/fr/viewstory.php?sid=8000,Sans Magie,"Et si Harry, Ron et Hermione avaient grandi dans un monde moldu ? S'ils étaient juste étudiants au lycée avec leur soucis de tous les jours ?"
Harry Potter,http://www.hpfanfiction.org/fr/viewstory.php?sid=12163&warning=4,Sans Magie - 2nd Opus,"Les amours évoluent et deviennent plus sérieuses... Jusqu'où pourront-ils aller ? Entre gaffes et tendresses, venez découvrir la suite directe de Sans Magie !"
Harry Potter,http://www.hpfanfiction.org/fr/viewstory.php?sid=12186,Sans Magie - Dernier Opus,"Deux ans ont passé et beaucoup de choses ont changé... Mais quelle est cette situation étrange ? Plus rien n'est à sa place ? Toujours des amourettes, des flirts, des sentiments... Peut être que tout doit (re)commencer... Qui sait ?"
Harry Potter,https://www.fanfiction.net/s/9653701/1/,Satiate His Hunger,"Hermione does her research in her sacred spot : The Library and something shocking reveals, the suspicion she held for his best friend. What will she do when Harry finds out she knows? What will HE do?"
Harry Potter,http://hp.adult-fanfiction.org/story.php?no=544196818,Say Yes,"She knows she should run, knows she should leave, but she surrenders to temptation and finds the place where she belongs."
Harry Potter,https://www.fanfiction.net/s/10322302/1/,Screw Them!,"Harry Potter had enough of the stupidity of the Wizarding World. If they all believed that he was a dark wizard, just because he could talk to snakes, screw them! He didn't need them. And who ever said that all prophecies did come true?"
