Fandom,Link,Title,Description
Final Fantasy X/X-2,https://www.fanfiction.net/s/4007751/1/,FFX Origins of a Hero,"Thrown into a unfamilar world, a young zanarkand experiances a series of events that change him from an out spoke athelete into a selfless hero of Spira as he challenges the cycle of death possible language and voilence warning"
Final Fantasy X/X-2,https://www.fanfiction.net/s/8487603/1/,Final Fantasy Guardians,"Sakura is a young Al Bhed girl full of life and spirit. She has a fairly normal life with her Uncle Cid and cousin Rikku. But when Rikku finds a strange boy washed up in a cave who claims he's from Zanarkand, a city destroyed for 1000 years, her life will change forever."
Final Fantasy X/X-2,https://www.fanfiction.net/s/8615168/1/,Final Fantasy X Novelization,"1000 years ago, an evil entity ravaged a never-sleeping city, sending the star player of the Zanarkand Abes a millennium into the future to meet a radiant summoner and her guardians who he journeys with on a pilgrimage to defeat the beast that destroyed his home town. Meanwhile, he learns horrific truths about his past and grows feelings for the summoner that he guards"
Final Fantasy X/X-2,https://www.fanfiction.net/s/6744736/1/,Final Fantasy X: Her Eternal Calm,"You know the story. But what if Yuna had chosen a different path for her ending, and ultimately create a new beginning? Her love for Tidus will change the course of Spira and the Eternal Calm forever."
Final Fantasy X/X-2,https://www.fanfiction.net/s/5119372/1/,Final Fantasy X: Our Story,"Told through the eyes of not famous-star-player-of-the-Zanarkand-Abes. But Tidus. Secrets will be uncovered, his hatred for his father renewed, and the love for another will blossom. Listen to his story. This may be our last chance."
Final Fantasy X/X-2,https://www.fanfiction.net/s/6678695/1/,Final Fantasy X3: Our Story,"Sin is abolished, Vegnagun is just a memory,and Yuna has finally been reunited with Tidus. What will Spira hold for them as they continue their journey together with their friends? Is this the fairy tale ending Yuna and Tidus hoped it would be?"
Final Fantasy X/X-2,https://www.fanfiction.net/s/2481044/1/,Fumbling Towards Ecstasy,"Near the end of her pilgrimage, Yuna decides she needs to extract a little more from life. One guardian is more than willing to help, til the end. An inevitable end made all the more horrifying, because she dared to love him."
Final Fantasy X/X-2,https://www.fanfiction.net/s/2216497/1/,Someday the Dream Will End,"When Tidus finds himself in a strange new world, how far will he have to go to get back home?"
Final Fantasy X/X-2,https://www.fanfiction.net/s/6009002/1/,Spira's Dream,"Tidus returns to Spira, but questions about how remain. Is he real this time? Or is something else going on with the secrets that Spira continues to hold?"
Final Fantasy X/X-2,https://www.fanfiction.net/s/6550824/1/,Spira's Dream : Spira's Revenge,"It seems Tidus isn't the only ghost from Zanarkand, and Spira's troubles aren't over yet."
Final Fantasy X/X-2,https://www.fanfiction.net/s/6023640/1/,Spira's Dream : Spira's Sphere,"As Tidus struggles to come to terms with the truth about what he is, the search for Spira's truth begins."
Final Fantasy X/X-2,https://www.fanfiction.net/s/3054771/1/,The Gunslinger,"Vincent Valentine: A hero of legend, sleeping through time. What happens when he wakes up in Spira to find a new terror destroying the land and a new group of heroes asking for his help?"
Final Fantasy X/X-2,https://www.fanfiction.net/s/2073042/1/,This Is My Story,"Yuna finally gets Tidus back, but with Baralai's disappearance and life like dreams channeling people's lives who lived 1000 years ago...she needs to save the day before settling down!"
Final Fantasy X/X-2,https://www.fanfiction.net/s/7823214/1/,Twist in Fate,"After escorting 3 summoners in a row, Lady Yue had enough. Until she meets up with Lady Yuna and her guardians that changed her world upside down. Follow Lady Yue as she gains new friends, new family and falls for a certain legendary guardian in red. But what awaits them all in Zanarkand?"
Final Fantasy X/X-2,https://www.fanfiction.net/s/8175955/1/,Unknown to Spira,"The past is found in the present, how many secrets have been hidden?"
Harry Potter,http://archiveofourown.org/works/3527738,"""Herbal"" Tea","Hermione brews a potion to help Ron and her clear the air and overcome their nerves, but Fleur's presence complicates things a little."
Harry Potter,http://archiveofourown.org/works/1405237,"""Initiation"" By Veela","After his heroics during the second task, Harry’s caught someone’s eye and she doesn’t have to take no for an answer."
Harry Potter,https://www.fanfiction.net/s/7663524/1/,3 Nights and 2 days,"During their stay at the Burrow before their fourth year, Harry and Hermione are forced to share a bed for three nights. They get acquainted with each other in a more intimate way."
Harry Potter,https://www.fanfiction.net/s/5178251/1/,30 Minutes That Changed Everything,"Year 2148: Gobal Population: 1. He made a mistake 150 years ago or so and now the human race no longer exists. For a century or so, he has sought a way to fix it all. Can he, or is the end of the world inevitable?"
Harry Potter,https://www.fanfiction.net/s/5703022/1/,40 Weeks of Waiting,"After adjusting to motherhood with James, Ginny finds out she pregnant again. So soon? Hermione is finally pregnant after almost a year of trying. Ginny finally has someone to share the next 40 weeks with, and glad its her best friend. Between Hermione's questions and Ginny's moods swings, its going to be a long 40 weeks."
Harry Potter,https://www.fanfiction.net/s/10965962/1/,A Badgers Champion,"The Potters had a plan for when the Dark Lord struck on Halloween. It was risky, but it worked. Lily and James Potter both survived the encounter, and their son was now the marked boy who lived. Eleven years later he sets off to Hogwarts with training to change the world. Little does he realize the Dark Lord he thought was gone, would return sooner rather than later."
Harry Potter,https://www.fanfiction.net/s/7758561/1/,A Blossom Amidst the Thorns,Hermione has an encounter before she starts at Hogwarts that will influence her throughout her school life. How long does it take for a crush to become obsession?
Harry Potter,https://www.fanfiction.net/s/5244813/1/,A Champion's New Hope,"Beginning during the Goblet of Fire, Harry looks to different friends for support after both Ron and Hermione refuse to believe that he did not put his name in the Goblet. Including one unexpected friend: Daphne Greengrass."
Harry Potter,http://archiveofourown.org/works/2060049,A Change That’s Better Than A Rest,Harry and Neville have a very unusual way to celebrate their birthdays: wife-swapping!
Harry Potter,http://hp.adult-fanfiction.org/story.php?no=600096882&chapter=1,A Cytherea game of hide-and-seek,"A story of Hermione's seducing Ginny during a game of hide and seek, hiding a spell where it was least expected."
Harry Potter,https://www.fanfiction.net/s/4489910/1/,A Different Beginning,What if Harry's life had been different? What if his parents didn't die? Join Harry in his adventure with his friends as he falls in love and fulfills the prophecy.
Harry Potter,https://www.fanfiction.net/s/4501842/1/,A Different Beginning : A New Beginning,"Harry and his friends enter seventh year and find heartache, happiness, pain, and see the end of the war. Join the characters as new babies, weddings, death, and the beginning of the future comes along."
Harry Potter,https://www.fanfiction.net/s/6439871/1/,A Different Halloween,Could a chance meeting change history? What would a different Halloween in 1981 mean for wizarding Britain?
Harry Potter,https://www.fanfiction.net/s/8416787/1/,A different life,"After the battle of Hogwarts, Harry hears some shocking news. Someone he thinks is dead is really alive which leads his life in a completely different directly that where his life was heading."
Harry Potter,https://www.fanfiction.net/s/7480393/1/,A Different Path,What if Harry had someone at the end of the Deathly Hallows to give him a different perspective on things? How might have this affected his decision to go to his death to save the magical world?
Harry Potter,http://ficwad.com/story/214496,A Different Sort of Bond,An unusual mishap in Sixth Year Potions makes Harry and Daphne Greengrass spend a lot of time together.
Harry Potter,http://ficwad.com/story/105634,A Different Way of Looking At Things,a surprising conversation in the summer between 6th and 7th year makes Harry think about Hermione in a whole new way
Harry Potter,https://www.fanfiction.net/s/9026676/1/,A Godfather's Gift: A Second Chance,"In the midst of a war ravaged house Sirius Black finds Harry alive. Making a choice that will change his life, he vows to live up to his promise to his best friend and raise his Godson as his own, forsaking his own desire for revenge. In the wake of his sorrow can be the parent Harry needs when his world fell apart? AU fic. Rated for very intense emotions and child death."
Harry Potter,http://hp.adult-fanfiction.org/story.php?no=600014984,A Lesson in Patience,Ginny decides to teach Harry a lesson in patience.
Harry Potter,http://hp.adult-fanfiction.org/story.php?no=600096710,A Lesson in Propriety,Ginny walks in on Harry and discovers that he is keeping secrets from her.
Harry Potter,https://www.fanfiction.net/s/7831005/1/,A Love Worth Fighting For,"A story of a love that surpasses the test of time. A love that lives in the past, present, and future. A love that should have never been, but quickly became the only thing worth fighting for."
Harry Potter,http://hp.adult-fanfiction.org/story.php?no=600097557&chapter=1,A Magical Foursome,Harry's fantasies are fulfilled in the Room of Requirement thanks to three of Hogwarts' most beautiful.
Harry Potter,https://www.fanfiction.net/s/8045114/1/,A Marauder's Plan,Sirius decides to stay in England after escaping Hogwarts and makes protecting Harry his priority.
Harry Potter,http://hp.adult-fanfiction.org/story.php?no=544201702,A Mother's Love,Narcissa Malfoy will do anything to protect her son from harm. And by 'anything' I mean Harry Potter.
Harry Potter,http://hp.adult-fanfiction.org/story.php?no=600097243,A Night To Remember,Harry and Hermione meet in the Room of Requirements.
Harry Potter,https://m.fanfiction.net/s/7321346/1/A-Path-of-His-Own,A Path of His Own ,His parents' deaths saved his life. Sirius' death saved his freedom. Harry sets out to face Voldemort on his own terms and without the meddling of Dumbledore. 
Harry Potter,http://ficwad.com/story/99144,A Perfect Mess,Losing your virginity can be awkward
Harry Potter,http://ficwad.com/story/226583,A Prefect's Duty,Harry get's the prefect badge of his fifth year and his Mother shows him part of a prefect's duty.
Harry Potter,http://ficwad.com/story/203390,A Second Chance,What would you go through to get the life you never had. Would you walk willingly into Hell even if you had only just managed to crawl out.
Harry Potter,https://www.fanfiction.net/s/6270721/1/,A Second Chance,Harry is given 2 weeks of vacation in London before returning to his 6th year at Hogwarts when he runs into Parvati. Alone and spending more time together they soon find love
Harry Potter,https://www.fanfiction.net/s/3659524/1/,A Shadowed Soul,"He was abandoned at a young age, the world believing him dead. They were wrong. Death Eaters believed untouchable are dying. Who is this assassin? Will he join Dumbledore or take the war into his own hands?"
Harry Potter,https://www.fanfiction.net/s/2959739/1/,A Sirius Matter,"A few days after being rescued from the dementor's kiss, Sirius Black decides to share information with Harry about his destiny. The story continues on from there."
Harry Potter,http://hp.adult-fanfiction.org/story.php?no=600096802&chapter=1,A Slave For You,"Fleur knew that Hermione belonged to her the moment they met. Now with the war over she comes to claim what's hers, whether Hermione wants it our not."
Harry Potter,https://www.fanfiction.net/s/5087292/1/,A Time to Dance,Harry one day comes across a woman he has not seen for many years.
Harry Potter,http://hp.adult-fanfiction.org/story.php?no=600096097,A Toy and a Friend,Hermione a recieves a gift and a surprise visit from Harry on her Birthday
Harry Potter,https://www.fanfiction.net/s/2966980/1/,A Very Harry Christmas,"The D.A is finished for Christmas. But Harry waits back to hopefully recieve a Merry Christmas from Cho. But he might get more, much much more. "
Harry Potter,http://ficwad.com/story/104755,A Weasley Tradition,"The war's over and Harry wants to marry Ginny. However, a Weasley 'tradition' may make this harder than he imagined. Written prior to DH"
Harry Potter,https://www.fanfiction.net/s/6647680/1/,Abracadabra,Hermione and Harry Granger are about to enter Hogwarts School of Witchcraft and Wizardry. Harry had a couple of extra passengers.
Harry Potter,https://www.fanfiction.net/s/6940483/1/,Accidents Should Happen,Hermione is in her 5th year and accidentally gets sent back in time when she breaks her Time Turner.
Harry Potter,https://www.fanfiction.net/s/7823720/1/,Accio Evans,"When Lily saw James on the Hogwarts Express to start seventh year, she knew he'd changed, and although she tries to deny it, she finds herself falling for the more mature head boy James. Sirius finds himself in more emotional confusion than he ever has and falling for a girl?"
Harry Potter,https://www.fanfiction.net/s/6082861/1/,Affliction,"Hermione had always wondered if it was the idea that the French were passionate, or if it was just Fleur herself that shone so brightly, so powerfully like a burning star that Hermione could only stare in wonder before she had to look away."
Harry Potter,https://www.fanfiction.net/s/5253688/1/,After the Battle,What happened between the final battle of Hogwarts and the Epilogue of 19 years later. How did Harry and Ginny get back together? What was their life like?
Harry Potter,http://hp.adult-fanfiction.org/story.php?no=600025759&chapter=1,After the Dawn,Harry Potter has defeated Voldemort. The wizarding world is finally at peace. But one old enemy managed to survive the curse that should have killed her... and she has a few tricks up her...sleeve.
Harry Potter,https://www.fanfiction.net/s/2917903/1/,All at Once,"Harry didn't go to Hogwarts, he went to Stonewall Secondary. His main goal in life was to leave the Dursleys' and go to college, until Remus Lupin finds him on his seventeenth birthday and his life changes all at once"
Harry Potter,https://www.fanfiction.net/s/6697318/1/,All My Loving,"Hermione is engaged to Ron and Harry to Ginny and everyone is happy, or so they think. What happens when memories brew sexual tension between Harry and Hermione? Who really loves who? Is it love at all?"
Harry Potter,https://www.fanfiction.net/s/6389117/1/,Alpha : Becoming Alpha,"A single difference changed Harry Potter as he began his life at the majestic castle known as Hogwarts. Collecting friends from all four Houses, he starts his journey by becoming the Alpha. Will the changes hinder or help his destiny?"
Harry Potter,https://www.fanfiction.net/s/7696294/1/,Alpha : Clash of the Alphas,"With just two more years at Hogwarts left, Harry must fight for his position as Alpha when another Alpha challenges him for it – twice. As the war comes to a high point, everyone must get along and fight for their lives or they stand to lose everything."
Harry Potter,https://www.fanfiction.net/s/6912457/1/,Alpha : Return of an Alpha,"For three years, Harry has been Becoming Alpha of Hogwarts. Now another Alpha is returning, bringing with him darkness, chaos, and battle. Watch as sides line up for war, and people and society change."
Harry Potter,https://www.fanfiction.net/s/11016545/1/,Always and Forever,"It starts at the end of Harry's third year, and continues thru his seventh. There is action in many of the chapters, but it's not the focus of the main story. I believe the overwhelming focus should be the main characters. I'm trying to write about a realistic and honest relationship between Harry and Hermione."
Harry Potter,https://www.fanfiction.net/s/4567665/1/,Amis ou presque,"Laissez moi vous raconter notre dernière année, à moi et à mes trois meilleurs amis. Elle fut magique et pleine de rebondissements..."
Harry Potter,http://hp.adult-fanfiction.org/story.php?no=600013657&chapter=1,An Unexpected Guest,Harry and Ginny are gagging for it and when an unexpected guest arrives things get kinky and hotter.
Harry Potter,https://www.fanfiction.net/s/6458927/1/,Angel on Campus,"They had turned their backs on Harry, in the time of his greatest need, so he left the wizarding world, to become a stranger, in a strange environment."
Harry Potter,https://www.fanfiction.net/s/5833390/1/,Another Night,After another D.A. meeting Harry and Susan have some fun in the room of requirement.
Harry Potter,https://www.fanfiction.net/s/6868216/1/,Après,Ma fic' commence directement après le tome 7 mais ne tient pas compte de l'épilogue
Harry Potter,http://ficwad.com/story/121955,Are You Being Served?,Harry and Ginny shop for a bed.
Harry Potter,https://www.fanfiction.net/s/8806745/1/,At The End Of All Things,"When Hermione dies, Harry is willing to do anything to save her"
Harry Potter,https://www.fanfiction.net/s/4238384/1/,Aucune Defense Pour Toi,"Fleur is not an expert in the ways of love, but in Hermione's final year with time running out, the learning curve is steep. Written, with permission, as a companion piece to Dreiser's ""No Defense for You"" in Fleur's POV."
Harry Potter,http://archiveofourown.org/works/1102595,"Baby, It's Cold Outside","Hermione really can't stay, the weather is getting bad. But her boyfriend has other ideas to keep the chill out and Hermione in his flat. A tale of the wolf and the mouse."
Harry Potter,https://www.fanfiction.net/s/3368821/1/,Baisers Mortels,"Elles sont sexy, délurées et absolument originales : Ginny et Hermione, toutes deux les à Serpentard... Vous allez les détester..."
Harry Potter,https://www.fanfiction.net/s/7392700/1/,Banking on Her,"Harry reckons his future is bleak if he stays at Hogwarts. The Tri-Wizard tournament offers him a fail-safe way of escaping his perceived destiny, that is until Harry discovered the hidden costs."
Harry Potter,https://www.fanfiction.net/s/4497753/1/,Be Prepared,"After Harry's 5th Year, Dumbledore decides that he must break his vow to the ministry and take dirct acton to help Harry fulfill his destiny."
Harry Potter,https://www.fanfiction.net/s/5163465/1/,Beginning of a New Life,"After the events of fourth year, Harry does not return to Privet Drive. He, with the help of Gringotts, decides to travel and learn as much as he can to help him in the fight against Voldemort."
Harry Potter,https://www.fanfiction.net/s/7049068/1/,Beginning to Question,"tarts summer after OOTP. Harry begins asking why, and gets help from an unexpected source to start facing his life head on."
Harry Potter,http://hp.adult-fanfiction.org/story.php?no=600022617,Behind Closed Doors,Early in the morning Harry is wide awake and so he goes to spy on Ginny invisible behind closed doors.
Harry Potter,http://hp.adult-fanfiction.org/story.php?no=544203011,Belongings,"Harry doesn't wan't anyone looking at Ginny, she is his and only his Exhib"
Harry Potter,https://www.fanfiction.net/s/9415372/1/,Beltane Child,"Harry needs some time to let his guard down in the war. So he goes to a celebration just before he, Ron and Hermione plan to get Hufflepuff's Cup from Bellatrix Lestrange's vault. Who could have guessed what the consequences would be?"
Harry Potter,http://hp.adult-fanfiction.org/story.php?no=600096173&chapter=1,Best Friends with Benefits,"Harry and Hermione are great friends, the best of friends... what happens when they decide to give their friendship some benefits? It's a good idea until it becomes a bad idea and it becomes bad really, really fast…"
Harry Potter,https://www.fanfiction.net/s/7611423/1/,Birthday Happiness,Harry is stuck at his office on his birthday... How is Hermione going to cheer him up when he gets home? Why using a Potions Magazine of course!
Harry Potter,https://www.fanfiction.net/s/8695313/1/,Black Heir,This is the Hawk-style version of the heavily overused Harry-gets-a-letter-from-dead-Sirius plotline and stuff happens due to this. Hopefully a good read in spite of this boring premise...
Harry Potter,https://www.fanfiction.net/s/7030601/1/,Black Magic Woman,"Six years after a brief moment just after the fall of the Dark Lord, Hermione and Narcissa meet again."
Harry Potter,http://ficwad.com/story/93950,"Black, Gray and White","Harry disappeared after the tri-wizard tournament. After 2 years he is back, but alot has changed..."
Harry Potter,http://hp.adult-fanfiction.org/story.php?no=600017360&chapter=1,Blackmail,"After the world cup, Ginny blackmails Harry into a relationship"
Harry Potter,http://hp.adult-fanfiction.org/story.php?no=600097200,Blame it on the Fire Whiskey,"After a night at the Hog's Head Inn Ron finds himself in bed with two very drunk and very horny girls, the rest is self explanatory"
Harry Potter,http://hp.adult-fanfiction.org/story.php?no=600006721&chapter=1,Blissful Escape,Hermione and Ginny escape within the walls of the Burrow
Harry Potter,https://www.fanfiction.net/s/4776013/1/,Blood of the Phoenix,A unique visitor during the summer rewrites Harry's world and sets him on the path to Voldemort's ultimate destruction. Takes place during Order of the Phoenix.
Harry Potter,https://www.fanfiction.net/s/10727210/1/,Blood of the Phoenix : Songs of the Phoenix,"After years of peace, Harry and his family and friends have moved on (as much as such a thing is even possible) but just when its time for the next generation to start at Hogwarts something wakes that might destroy the life that Harry and the Order worked so hard to achieve. "
Harry Potter,https://www.fanfiction.net/s/6519893/1/,Blood of the Phoenix : Tears of the Phoenix,"With a new family and new friends, Harry takes the final steps toward defeating Voldemort once and for all."
Harry Potter,https://www.fanfiction.net/s/8818451/1/,Bloodlines,Harry's friends abandon him after his name comes out of the Goblet of Fire. He finds an unexpected ally and an underground secret society that shows him that not everything is what it seems.
Harry Potter,https://www.fanfiction.net/s/8076284/1/,Bonds of Time : Harry Potter And The Bonds Of Time,"During the memorial party marking the third anniversary of the Battle of Hogwarts, Death Eaters attack the Ministry of Magic. In the skirmish, Harry and Ginny Potter wind up in the Time Chamber, a part of the Department of Mysteries and fall into a mysterious pool of water. When they wake up, Harry is eleven years old again and back on Privet Drive, and Ginny is ten and back in the Burrow, but they have their memories, thoughts and magical knowledge of their older selves. Stuck in the past with no way back, they decide to change the future for the better."
Harry Potter,https://www.fanfiction.net/s/8531904/1/,Bonds of Time II: Fighting Fate,"Bond-Mates Harry and Ginny Potter seek to change the future for the better. Weddings, pregnancy and romance looms on the horizon, but so does Death, loss and sacrifice. How can you win when you're fighting against Fate?"
Harry Potter,https://www.fanfiction.net/s/10516568/1/,Bonds of Time III: Age Of Consent,"Book 3 in the Bonds of Time Saga. Bond-Mates Harry and Ginny Potter thought the worst was over when they emerged victorious after the Battle of Little Hangleton. How very wrong they were. Now they have to deal with the Soul-Bond's True Power. Unpredictable, surprising consequences arise due to their Bond. To make it worse, an old enemy appears and turns everything upside down for Harry, Ginny and their friends."
Harry Potter,https://www.fanfiction.net/s/6927410/1/,Both More Wondrous and Terrible,"Harry discovers the 'power he knows not'. His power can save the world from Voldemort, but can it save Harry?"
Harry Potter,https://www.fanfiction.net/s/9197497/1/,Bound,Another soul-bond story with an unusual twist – good people.
Harry Potter,https://www.fanfiction.net/s/7093738/1/,Brutal Harry,"Systematically abused and degraded children do not suddenly turn into well-adjusted members of society when removed from the abusive situation. Nor do they tend to be very trusting of others, or forgiving."
Harry Potter,https://www.fanfiction.net/s/8532802/1/,Brutal Harry : Hero Harry,"As Magical England grinds itself through civil war and Magical Europe at large collapses in upon itself, Harry hunts through it all. Dumbledore has disappeared, Lucius Malfoy has publically fallen out with Fudge, and most the population of Hogwarts has fled to America, bringing many families of Muggleborns with them."
Harry Potter,http://hp.adult-fanfiction.org/story.php?no=600024701,Bubble Bathos,Harry listens to Hermione for once and things turn out rather well 
Harry Potter,https://www.fanfiction.net/s/6427995/1/,Building Bridges,"Harry was proclaimed dead when he was two years old and ended up in an orphanage. But that was only the beginning of his journey. While trying to find his place in the world of magic, he never forgets those whom he views as family."
Harry Potter,https://www.fanfiction.net/s/3400326/1/,Butterfly,"What if Parvati didn't want to go dancing with that boy from Beauxbatons, and dragged Harry onto the dance floor instead? A simple action leads them both into a much darker destiny filled with romance, danger and prophetic visions."
Harry Potter,http://hp.adult-fanfiction.org/story.php?no=600007135,By Dawn's Early Light,The Burrow is always quiet in the hours following dawn. 
