Fandom,Link,Title,Description
Naruto,https://www.fanfiction.net/s/4625872/1/,Fire Shadow's Son,"AU, post-Valley of the End. What if Kakashi made it to the valley in time? What if the events of the Kyuubi's defeat played out differently? How would things turn out then? Yondaime lives!"
Naruto,http://naruto.adult-fanfiction.org/story.php?no=544196664,Flowers and Friends,"Some InoSakura lovemaking, affection."
Naruto,https://www.fanfiction.net/s/10287521/1/,For the Love of the Hokage,"Promising to yourself that you'll be with the guy of your dreams is easy. Try doing that now when said guy becomes the hero of the world, the Rokudaime Hokage, and the object of a thousand girls' fantasies. Time to break some boundaries… for the love of the Hokage."
Naruto,https://www.fanfiction.net/s/10738792/1/,For the sake of Icha Icha!,Jiraiya has the last task for Naruto to finish his three-years long training trip – to sneak into women's bathhouse and bring back quality material for his new book! Little does Naruto know that a certain girl is visiting the onsen as well…
Naruto,https://www.fanfiction.net/s/7380611/1/,For your entertainment,Naruto's heart has taken a few hits over the years after the war. Ino wanted to cheer him up somehow and get her friend back. But who knew that her yearning for entertainment would lead to all this.
Naruto,https://www.fanfiction.net/s/4695920/1/,Fox And Cat,"After being gone for a year and a half longer then he was suppose to, Naruto returns home with a cloaked stranger at his side."
Naruto,https://www.fanfiction.net/s/8817985/1/,"Foxes, a Sword and a Promise","In a world where anything can happen, a young ninja in training finds an object of unusual value which starts him on his way down the path to become Hokage. Standing in his way are many trials and experiments gone wrong, and the one to help him find his way is the person he'd never thought was capable. Find out how a few chance events can change lives..."
Naruto,https://www.fanfiction.net/s/7029622/1/,From the Bet to the Marriage,The problem of the Hokage is the problem of Naruto. Why does he have to do everything the Hokage said? Will this time be the same when he is asked into a certain arrange marriage?
Naruto,https://www.fanfiction.net/s/6148718/1/,Garden Passions,In which the flower girl Ino has a passionate experience at one of her favorite places in the entire world.
Naruto,http://naruto.adult-fanfiction.org/story.php?no=600100865,Gencom Naruto,"Naruto gains a special, perverted computer program. What could go wrong?"
Naruto,https://www.fanfiction.net/s/6634037/1/,Gently Falling,"Naruto has returned home from his training journey with Jiraiya. He expects to fall back into his old habits. But as he is walking through town, a midnight haired beauty catches his eyes, and throws a wrench in his plans."
Naruto,https://www.fanfiction.net/s/7304685/1/,Get In Shape Hinata !,"Naruto notices that his girlfriend Hinata has gained a bit of weight, so what does he suggest? Swimming! The only thing is, Hinata can't swim. What could be more embarrasing than that? Having Naruto teach her!"
Naruto,https://www.fanfiction.net/s/9809101/1/,Getting Laid at a Halloween Party,Hinata is going to a Halloween party with her friends at Sasuke's house. She was forced into a French maid costume but finds Naruto there. They talk and drink punch unaware that it's been spiked. Will this lead to a confession? Will Naruto accept it? Will the punch lead to something between the two friends?
Naruto,http://naruto.adult-fanfiction.org/story.php?no=600005521,Girls Night In,"Sakura, Ino, TenTen, Temari, Hinata, Shizune, and Tsunade share their favorite sex stories with eachother... along with sake and Oreos..."
Naruto,https://www.fanfiction.net/s/5033127/1/,Godaime x Rokudaime,Naruto's day as the sixth hokage got him really tired. read and find out how he loses all of this stress.
Naruto,https://www.fanfiction.net/s/5623008/1/,Golden Eyes,"After being rejected for training by Kakashi, Naruto rages away from Konoha. He discovers something. It is not a bloodline nor a gift but an accident. It is an accident that will allow Naruto to destroy his enemies. Simply put, Naruto now has Golden Eyes."
Naruto,https://www.fanfiction.net/s/7628123/1/,Good Girls Go Bad,When Hinata went clubbing with her friends the last thing she expected was a sexy blond to come whisk her away for a wild night out.
Naruto,https://www.fanfiction.net/s/7740993/1/,Grudge,The Leaf has been mislead by the Mist to attack the Sand breaking the alliance. When things are all straightened out Temari must remain in the village while Kankuro delivers paperwork for Gaara to sign.
Naruto,http://naruto.adult-fanfiction.org/story.php?no=600105395,Hands Tied,"When she told him she could love him with her hands tied, she didn't think he would take it so literally."
Naruto,http://naruto.adult-fanfiction.org/story.php?no=600102087,Happy B-Day Hinata,Hinata is 18 today and her best friends get her the gift she always wanted.
Naruto,http://naruto.adult-fanfiction.org/story.php?no=600105486,Happy Birthday Naruto!,"""I'm dying to taste you."" He said with conviction. When he pressed the tip of his nose against her slit, she groaned.""Then do it!"" Naruto's head spun with pure lust, the pink petals of her slit glistened with her essence..."
Naruto,https://www.fanfiction.net/s/5723211/1/,Have you ever?,In which Ino asks her boyfriend if he has ever made love to someone.
Naruto,https://www.fanfiction.net/s/9593245/1/,He who will change the Shinobi,"During the battle on the bridge in Wave, when Naruto used Kyuubi's power, Nine-Tails felt something he detested: Sasuke's new Sharingan. Discovering that something was preventing his host from reaching his full potential, he did the math. Results? He will give a small helping hand to his host so that he could surpass the Uchiha."
Naruto,https://www.fanfiction.net/s/10809738/1/,Helping a Sensei,"Years after Asuma's death, Kurenai is struggling with her needs. Fortunately, her old student is willing lend her a hand... and a man."
Naruto,https://www.fanfiction.net/s/10725280/1/,Herald of the End,"The world can be forever changed by the simplest of choices. When Sakura takes a different path home one day after the Academy,Naruto gains a new goal: Protect his precious people. No matter the odds. No matter the cost. Konoha, what have you created?"
Naruto,https://www.fanfiction.net/s/10534847/1/,Hero or Monster,"One man's evil is another's salvation. ""Death to all enemies of heaven."" - Bringer of Hope"
Naruto,https://www.fanfiction.net/s/4149308/1/,Heroes Come Back,"Naruto is kidnapped as a baby and grows up not knowing his origin, but when he comes back to konoha he'll find more then just who his parents were, he'll find what he's been looking for all along."
Naruto,https://www.fanfiction.net/s/4741819/1/,Hidden Treasure,"The most precious treasure on Earth is seen with the heart, not the eyes."
Naruto,https://www.fanfiction.net/s/3785123/1/,High Voltage!,"School, work, cup ramen, and a hot roommate. How will Tenten be able to settle down in this strange new environment?"
Naruto,http://naruto.adult-fanfiction.org/story.php?no=600093922,Hinata grows bolder,Poor shy little Hinata... Her crush Naruto doesn't even know she exists. It's because ot that shy attitude of hers.
Naruto,https://www.fanfiction.net/s/8742791/1/,Hinata the Slave,"this is the orriginal story that was deleted by the admins during the purges and it is coming back online in its integrity Main pairing is Naru/Tenten with a submissive Hinata, Ino and Sakura."
Naruto,https://www.fanfiction.net/s/10027728/1/,"Hinata, from failure to lover","Hinata Hyuga, heiress to Konoha's most powerful clan, Academy student ... suicidal 11 year-old. Uzumaki Naruto, code name Yoru, ANBU agent, stealth specialist. He will teach her the ways of shadows, she will teach him to welcome people in his heart, and they will teach each other the worth of life."
Naruto,http://naruto.adult-fanfiction.org/story.php?no=600105255,"Hinata, It can't be helped!",Hinata finally figures out what will attract Naruto to her but then something goes horribly wrong... or right.
Naruto,https://www.fanfiction.net/s/4556934/1/,Hinata's Bravery and Naruto's Realization,"Something goes wrong on a mission and Naruto finally gets something through his thick skull, but how will everyone react to it? What does Hiashi have planned?"
Naruto,https://www.fanfiction.net/s/3118420/,Hinata's Darkened Desires,"Hinata goes through a ... mind alteration, performed by Ino. When she's around Naruto, she slowly loses her inhibitions. While on a mission to subdue a rising evil, she decides how she will get him"
Naruto,https://www.fanfiction.net/s/4617925/1/,Hinata's Decision,Hinata Hyuuga is a shy nineteen year old girl who wants a certain blonde ninja. But she never has the nerve to tell him. But what if something inside her gave her the courage to get her blonde? Both teens are going to be shocked at her nerve.
Naruto,https://www.fanfiction.net/s/3108435/1/,Hinata's New Life,"Hinata's father disowns her, with no place left to go she moves in with Naruto. However problems arise once Hinata's little sister Hanabi comes to live with them and falls in love with Naruto"
Naruto,https://www.fanfiction.net/s/9269608/1/,Hokage and the Healer,Naruto has defeated Pein and become the hero of the Village Hidden in the Leaves. Sakura feels useless as Naruto as left her in the dust again. She finds comfort and solace in the arms of her mentor and Hokage Tsunade.
Naruto,https://www.fanfiction.net/s/10546118/1/,Hokage becomes Prey,Tsunade has been making Naruto take countless missions. He's now going to show her that EVERYONE needs a break ONCE in a while.
Naruto,https://www.fanfiction.net/s/5158343/1/,Homophobie,"Hanabi ne supporte par de voir sa sœur avec une autre fille ; ce n'est pas compliqué, l'horreur la submerge lorsqu'elle la voit embrasser Tenten. Pourtant, quelqu'un réussit, bien malgré elle, à la convaincre du contraire."
Naruto,http://naruto.adult-fanfiction.org/story.php?no=600097792&chapter=1,Honeysuckle Tea,"Hinata and Naruto start a relationship in the new era of peace that has begun. As time goes on, the couple begins to feel that maybe they want something more in their relationship."
Naruto,http://naruto.adult-fanfiction.org/story.php?no=600091908,Horny Hokage,Relax It's Tsunade Hinata is called into the Hokage's office
Naruto,http://naruto.adult-fanfiction.org/story.php?no=600091200,Hot n' Heav Training Session,A little tussle and blindfold and what have you got...?
Naruto,http://naruto.adult-fanfiction.org/story.php?no=600103763&chapter=1,Hot Springs and Gloryholes,Random Naruto and/or Kiba/Various PWP Series...
Naruto,https://www.fanfiction.net/s/9485028/1/,How Destiny Turns,"Through a fantastic set of circumstances, Naruto stumbles upon the Shadow Clone Jutsu a year early and uses it to graduate when he's eleven. A fresh Genin, he's placed on a team with Neji Hyuuga and TenTen Jinta, Might Guy being their sensei. This event ripples across the pages of history books in the Leaf, and Team 9 is intent to show how to turn the tide of destiny."
Naruto,https://www.fanfiction.net/s/5094148/1/,How Many,How Many times can a heart be torn aside before real love is found. this is a one shot where Naruto has ups and downs and finds love and acceptance.
Naruto,https://www.fanfiction.net/s/4446974/1/,Hunter? Or Hunted?,"Tenten is a world famous monster hunter, she's killed everything from demons to werewolves, but on a routine hunt, she's captured by the vampire she's hunting. Will she be able to escape her captor? Or will she fall for her?"
Naruto,http://naruto.adult-fanfiction.org/story.php?no=600097115&chapter=1,I Kissed A Girl,"Ten-Ten has a bit much to drink, Hinata's been slipped a aphrodisiac and where does Neji fit in all this?"
Naruto,https://www.fanfiction.net/s/5088582/1/,Icha Icha paradise: Chronicales!,"Love, passion, Drama! All rolled into one great book. This is 5 tales, that will make the heart beat in tone with the stories tempo! A story that has great action to it!"
Naruto,https://www.fanfiction.net/s/9522299/1/,Icha Icha Paradise: The Jinchuuriki and the Blonde Wildflower,"Ino is kidnapped by a group of Iwagakure ninja who demand Naruto's head in exchange for the blonde kunoichi. After defeating the ninja and saving Ino, they return to Naruto's house where Ino thanks him for his heroism."
Naruto,https://www.fanfiction.net/s/9629534/1/,Icha Icha Paradise: The Jinchuuriki and the Cherry Blossom,"Sakura is devastated after the death of her teammate Sasuke in the recent war. But when Naruto prevents her from taking her own life, Sakura realizes where her true feelings lay and thanks Naruto in a way he never bargained for."
Naruto,https://www.fanfiction.net/s/9572795/1/,Icha Icha Paradise: The Jinchuuriki and the Hyuga Heiress,"After a day of playing in the snow, Naruto and Hinata return home to the Hokage Mansion where things ""heat up"" in a hurry."
Naruto,https://www.fanfiction.net/s/9842111/1/,Icha Icha Paradise: The Jinchuuriki and the Sand Sibling,"After two straight weeks of working in the Hokage Office nonstop, Naruto is taking a well-deserved vacation in Tanzuka Town. But what ""repercussions"" will Naruto face when he walks in on a nude Temari in the hot springs by accident."
Naruto,https://www.fanfiction.net/s/9178250/1/,Icha Icha Paradise: The Jinchuuriki and the Snake Temptress,"After a day of hard training, Naruto and Anko retire to the Hokage mansion where Anko ties up Naruto and teases him into some ""extra-curricular"" activities."
Naruto,https://www.fanfiction.net/s/10304192/1/,Icha Icha Paradise: The Jinchuuriki and the Weapons Mistress,"Naruto acquires some new weapons from Tenten and her father and after testing his weapons in a sparring session against her, she decides to play with another ""secret weapon"" of Naruto's."
Naruto,https://www.fanfiction.net/s/3951585/1/,Illegitimate Love,"One night of passion can lead to a lifetime of happiness. At least, that's how it is in movies."
Naruto,http://naruto.adult-fanfiction.org/story.php?no=600091138,In A Friends Embrace,This is set after Sasuke runs off to join Orochimaru Sakura seeks comfort in the arms of her childhood friend Ino and realizes she doesn't need a man to be happy
Naruto,http://naruto.adult-fanfiction.org/story.php?no=600096038,In Love,"This fic explores the concept of polyamory. Being in love with more than one person at the same time and being committed to both equally, though perhaps in different ways. So no, it’s not just porn, although there’s quite a bit of it in here. This is me playing around with Shikamaru and his girls. Because yes, I do love Ino to death. Temari too."
Naruto,https://www.fanfiction.net/s/10336735/1/,In the Flower Field,"Today was the day I'm going to confess to my best friend that I love her, Ino Yamanaka was standing in the flower field in her mind was that exact thing she was determined to reveal her feelings for she thought she couldn't hold them in any longer. She sees her friend make it up the hill."
Naruto,https://www.fanfiction.net/s/4334191/1/,Ino's chance,What all can Ino do with her family jutsu. read and find out.
Naruto,https://www.fanfiction.net/s/10096343/2/,Invisible Fox,An accident bestows a completely new Kekkai Genkai on an orphaned boy.
Naruto,https://www.fanfiction.net/s/7117200/1/,It Must Be The Heat,Kurenai and Anko are frustrated and don't know what to do until they hear a disturbance at Training Ground 9. They find Naruto training hard and suddenly the answer to all of their problems are right before their steamy & lusting eyes.
Naruto,https://www.fanfiction.net/s/5409165/1/,"It's For a Good Cause, I Swear!","After receiving a time travel jutsu as payment for a mission, the original four members of Team 7 each get a chance to go back to one event in their life and change it. Surely they will use such an awesome power responsibly...right? Don't count on it."
Naruto,http://naruto.adult-fanfiction.org/story.php?no=600101787,It's My Life,"After a mission that almost leads to her death, Sakura realizes there are things she still wants to do before she dies."
Naruto,https://www.fanfiction.net/s/8673293/1/,Ivresse,"Naruto, jeune professeur à l'université, se contente d'une vie remplit de quiétude. Marié à son grand amour, il accepte d'elle, l'inacceptable. Son meilleur ami partage avec lui leur passion commune pour l'enseignement et se concrétise lorsqu'ils sont promus tous les deux, professeurs dans la même faculté. Naruto se résigne à cette vie... Oui...! Mais jusqu'à quand...?"
Naruto,https://www.fanfiction.net/s/5750025/1/,Jiraiya's Last Student,"After coming back from one of his missions, Jiraiya finds his 10 year old godson not being taken care of, Jiraiya decides to take Naruto away and train him. How will everything change? NaruHina strong Naruto AU. A little Sasuke and Sakura bashing in the beginning but none later on. The story was made before the foxes name got revealed deal with it."
Naruto,https://www.fanfiction.net/s/9649118/1/,Just Like the Folks: The Orange Hokage and the Pink Medical Kuniochi,Naruto and Sakura play trivia games until she figures out a way to make the game itself spicier than normal.
Naruto,https://www.fanfiction.net/s/10188540/1/,Just Like the Folks: The Orange Hokage and the Purple Snake,"On a nice sunny day, Naruto finds Anko bathing in the public lake and she catches onto him, he is chased and captured by her. However, he receives a startling discovery from Anko and realizes her true intentions."
Naruto,https://www.fanfiction.net/s/10058156/1/,Just Like the Folks: The Orange Hokage and the Red Flute Player,Naruto gives the imprisoned Tayuya a conjugal visit and finds she's very pleased to have him visit.
Naruto,https://www.fanfiction.net/s/9753204/1/,Just Like the Folks: The Orange Hokage and the Violet Flower,"When Ino is depressed by Inoichi's death, Naruto does what he can to cheer her up and he does just that. Then, Ino proceeds to connect with him in a surprisingly, warm matter than amazes him in more than one way."
Naruto,https://www.fanfiction.net/s/10211844/1/,Just Like the Folks: The Orange Hokage and the Yellow Sand Sickle,"After attending the Kage Summit, Naruto and his bodyguards find themselves stranded at a local inn by a temporary snowstorm. However, Gaara is also there and this allows Temari to catch up with Naruto."
Naruto,https://www.fanfiction.net/s/6606844/1/,Just Reward,"It's Naruto's eighteenth birthday, and two changed kunoichi decide to make it special in their own individual ways. But what Naruto eventually gets is something twice as big."
Naruto,http://naruto.adult-fanfiction.org/story.php?no=600102348,Kage-Con,Tsunade/Mei
Naruto,https://www.fanfiction.net/s/9311062/1/,Kages and the Sage,"Naruto and Tsunade meet with Mei for a meeting about the future of their villages, that quickly falls apart."
Naruto,https://www.fanfiction.net/s/4957381/1/,"Kitsune and Rose: Milk, Sake, and Dango Edition",MSD has done another redition of another one of my fics. My NaruTema one so if you don't know about him go read his story A Basket Full of Lemons.
Naruto,http://naruto.adult-fanfiction.org/story.php?no=600105438&chapter=1,Kitsunes Seduction,He is done playing the fool and is out for what he wants. And what he wants is the females of the leaf
Naruto,https://www.fanfiction.net/s/5016564/1/,Konoha's young sage,"Raised by the toads of the Mebokuzan mountain, Naruto is now back to the ninja world, Konoha. But will Konoha accept him?"
Naruto,http://www.devianthearts.com/viewstory.php?sid=1522&chapter=1,Kunoichi Love,"Six stories of love in it's varied stages, all tied together through chance happenings.  Budding romances, lifelong bonds, and even the most unusual of circumstances can bring two people to each other and sometimes... it even provides the means to keep them together."
Naruto,https://www.fanfiction.net/s/9728450/1/,Kushina's Unchained Lust,"Unchained and unleashed, Kushina becomes the fox beauty of lust as she craves for a harem of beautiful women to restore her clan. Only Naruko and Hinata must stop her until Naruto returns and every woman is controlled. Question is: Can they stop getting distracted from Kushina's horny harem?"
Naruto,https://www.fanfiction.net/s/9759159/1/,Kushina's Wife Test,"After awakening from a 18 year coma, Kushina Uzumaki reunites with her son, now fully grown, to find that he's happily in a relationship with the Hyuuga heiress. So, as his mother, she's dedicated herself to ensuring that Hinata is the perfect wife for her boy."
Naruto,http://naruto.adult-fanfiction.org/story.php?no=600099297,Kyuubi's Pet,"Join Ino, Hinata and many other nubile ninja babes as they are subjected to a number of hilariously erotic happenstances, most at the hands of the corrupted Sakura - the Kyuubi's Pet."
Naruto,https://www.fanfiction.net/s/5946195/1/,L'erreur de ma vie,"Shikamaru est un érudit travaillant pour l'église, dont la vie changea lorsqu'il rencontra une succube."
Naruto,https://www.fanfiction.net/s/5667883/1/,la Loi du Silence,"Six mois aprés Pain, Naruto a été bannit de Konoha. Un an et demi après c'est le tour de Hinata. Agée de 18 ans, Hinata, nukenin, vit en détroussant et tuant les ninjas qu'elle rencontre mais la rencontre d'une vieille connaissance à Suna va tout changer."
Naruto,http://ficwad.com/story/231929,Land of perverts:Everyone has Perverseness,A master teaches knowledge to his pupil. Helps him to become strong. But in Konoha there is a catch. Master passes his pervecy. Watch Naruto as he carries pervecy of his Masters.
Naruto,https://www.fanfiction.net/s/10075237/1/,Last Night,"After winning the war, Naruto and Sasuke decide to celebrate by hitting the town. After a few drinks everyone calls it quits and seeing as they now lived close by, Naruto offers to walk Hinata home that soon leads to a night of confessions, emotions, and passion."
Naruto,https://www.fanfiction.net/s/4901116/1/,Lavender Love,"Naruto returns from his training and promptly meets Hinata Hyuga after three years apart. Stunned, the shy kunoichi and the brash young Jinchuuriki head to Ichiraku. And that was just the beginning. What happens next? Only time will tell..."
Naruto,https://www.fanfiction.net/s/6218397/1/,Le son d'une clochette : Prologue,"Alors que l'heure du retour de Naruto approche à grands pas dans le village de Konoha, Kanan Namikaze la Traitresse revient après 16 ans d'absence avec son fils Homura Nagisa."
Naruto,https://www.fanfiction.net/s/6594870/1/,Le son d'une clochette Saison 1 : L'équipe 7,"Voici la suite de la fanfic Le son d'une clochette et également le début des aventures d'Homura en tant que ninja de Konoha! Son équipe, son capitaine, ça promet d'être épique!"
Naruto,https://www.fanfiction.net/s/9428374/1/,Leaf Village Lust,Naruto and Tsunade have been together for several months and have managed to hide their relationship from the village. until now.
Naruto,http://naruto.adult-fanfiction.org/story.php?no=600105336,Leaves on Gold Sand,Temari wants to thank Naruto for saving Gaara during the Rescue the Kazekage
Naruto,https://www.fanfiction.net/s/9285638/1/,Leftovers,"Due to certain events, Kurenai finds herself the reluctant sensei of a student that makes her genjutsu look like infomercials. Thus is the story of Team 11."
Naruto,https://www.fanfiction.net/s/7745648/1/,Legacy of Uzushiogakure,"The 2nd Shinobi World War left Uzu destroyed out of fear. Its inhabitants were left slaughtered or scattered. However, what if the members of Uzushio's famed Uzumaki weren't as scattered as people thought? What would it mean for one Uzumaki Naruto?"
Naruto,http://naruto.adult-fanfiction.org/story.php?no=600105468&chapter=1,Legendary Lovers,"A post-war celebration leads to large consumptions of alcohol and a couple dirty games, producing a night that Naruto, Sakura, and Sasuke won't soon forget."
Naruto,https://www.fanfiction.net/s/5635506/1/,LemonyPedia: Naruto and his Girls!,The name sucks... anyway this is a gather of A LOT LEMONS! all of them are naruto centric and with all the girls you can imagine... thx to all the authors who made this possible.
Naruto,https://www.fanfiction.net/s/8134405/1/,Les Rivaux,"Rien ne va plus entre Sasuke et Sakura. Alors que leur mariage bat de l'aile, Naruto décide de tenter sa chance auprès de la jeune femme"
Naruto,http://naruto.adult-fanfiction.org/story.php?no=600090564,Lessons,Anko teaches Ino what it means to be a real kunoichi
Naruto,https://www.fanfiction.net/s/9619405/1/,Let Me Love You,Naruto and Tsunade have fallen in love. . .
Naruto,https://www.fanfiction.net/s/7132681/1/,Let's Get Married,It was supposed to be a simple solution to their immediate problems. But maybe they took more than they can chew?
Naruto,http://naruto.adult-fanfiction.org/story.php?no=600093681,Lets Get Naked,"Tired of being denied, Anko breaks into the room of the one she wants so badly and waits for the other woman to come home, her reward for her impatience? One unforgettable night."
Naruto,https://www.fanfiction.net/s/4101517/1/,Like the Moon to the Stars,"You all asked for it, here it is. HinataxHanabi lemon, w00t"
Naruto,http://ficwad.com/story/128355,Lilith's Heir,"Naruto was sent to hell, only to be adopted by Lilith, queen of the succubi, now watch as naruto takes what he wants from konoha"
Naruto,http://naruto.adult-fanfiction.org/story.php?no=600104805,Liquid Passion (Side Stories),"These stories are side stories to the main storyline, and they will be kinda short but they give a little background."
Naruto,https://www.fanfiction.net/s/3444194/1/,Living Among Leaves,"What begins as a simpple mission becomes a relationship, and then an adventure for all of Konoha."
